Title,Author(s),Source,Date Published,Category,Tags,Summary,URL,Date Added
"Mechanisms of long COVID and the path toward therapeutics","Michael J. Peluso, Steven G. Deeks","Cell","2024-10-03","Long COVID","long COVID, therapeutics, mechanisms, pathogenesis","This review discusses the mechanisms underlying long COVID and explores the potential paths toward therapeutic development, offering insights into persistent symptoms and recovery challenges.","https://www.cell.com/cell/fulltext/S0092-8674(24)00886-9?_returnURL=https%3A%2F%2Flinkinghub.elsevier.com%2Fretrieve%2Fpii%2FS0092867424008869%3Fshowall%3Dtrue","2024-11-30"
"How Federal COVID Relief Flows to the Criminal Justice System","Anastasia Valeeva, Weihua Li, Susie Cagle","The Marshall Project","2022-09-07","COVID-19 Relief Funding","ARPA, COVID-19 relief, law enforcement funding, criminal justice system, public spending","This analysis examines how funds from the American Rescue Plan Act were used by cities and states, revealing billions allocated to police, jails, and courts under flexible spending guidelines that reflect local priorities during the pandemic.","https://www.themarshallproject.org/2022/09/07/how-federal-covid-relief-flows-to-the-criminal-justice-system","2024-11-30"
"‘Alarming’ rise in Americans with long Covid symptoms","Melody Schreiber","The Guardian","2024-03-15","Long COVID","long COVID, CDC, prevalence, public health","This article discusses the increase in long COVID cases in the U.S., highlighting CDC data indicating that nearly 18 million Americans are experiencing long-term symptoms, with significant impacts on daily activities.","https://www.theguardian.com/world/2024/mar/15/long-covid-symptoms-cdc","2024-11-30"
"Long COVID in Children: A Multidisciplinary Review","Francesco Sansone, Giulia Michela Pellegrino, Antonio Caronni, Federica Bonazza, Elena Vegni, Alberto Lué, Tommaso Bocci, Carlotta Pipolo, Giuliano Giusti, Paola Di Filippo, Sabrina Di Pillo, Francesco Chiarelli, Giuseppe Francesco Sferrazza Papa, Marina Attanasi","Diagnostics","2023-06-07","Long COVID and Children","Long COVID, children, multidisciplinary review, pediatrics, respiratory symptoms, neurological symptoms, gastrointestinal symptoms","This review explores Long COVID in children, highlighting its diverse manifestations across respiratory, gastrointestinal, neurological, and psychological domains. It emphasizes the importance of a multidisciplinary approach to diagnosis and management and discusses potential mechanisms and therapeutic strategies.","https://pmc.ncbi.nlm.nih.gov/articles/PMC10297324/","2024-11-30"
"After all these years, did any of you get any type of permanent damage from getting covid? If so, what is it?",Reddit Users,"r/AskReddit","2024-09-23","Long COVID","long COVID, health problems, personal experiences, Reddit discussion","This Reddit thread features users sharing their experiences with long COVID and its associated health problems, including permanent damage and chronic symptoms.","https://www.reddit.com/r/AskReddit/comments/1fmy2bo/after_all_these_years_did_any_of_you_get_any_type/?rdt=59077","2024-11-30"
"Millions of US Children Experience Range of Long COVID Effects","Emily Harris","JAMA","2024-02-14","Long COVID and Children","long COVID, children, health effects, cognitive issues, mental health, head and neck symptoms","This article examines the prevalence and diverse manifestations of long COVID among children in the United States. Approximately 6 million children are affected, with symptoms ranging from loss of smell and taste to cognitive impairments and mental health challenges like anxiety. Cardiac issues, though rare, were also observed.","https://jamanetwork.com/journals/jama/article-abstract/2815350","2024-11-30"
"Long COVID is a 'public health crisis for kids,' experts say","Nicole Karlis","Salon","2024-08-26","Long COVID and Children","long COVID, public health crisis, children, persistent symptoms, mental health","This article highlights the growing impact of long COVID on children, contradicting earlier beliefs that COVID-19 infections in children are mild. It discusses persistent physical and mental health symptoms among children and calls for urgent public health interventions to address the crisis.","https://www.salon.com/2024/08/26/long-is-a-public-health-for-kids-experts-say/","2024-11-30"
"Long COVID significantly affects children for up to 36 months; vaccines offer crucial protection","Dr. Chinta Sidharthan","News-Medical","2024-09-08","Long COVID and Children","long COVID, children, vaccine protection, autoimmune disorders","This article discusses a study revealing that long COVID can impact children for up to 36 months post-infection, with symptoms like fever, rhinitis, and cough. Approximately 23.2% of children met the criteria for long COVID at the three-month follow-up, decreasing to 7.9% after one year. Notably, 1.1% developed new-onset autoimmune disorders, such as Hashimoto Thyroiditis and Celiac Disease. The study emphasizes that three doses of the COVID-19 vaccine offer significant protection against long COVID and reinfections, especially in older children.","https://www.news-medical.net/news/20240908/Long-COVID-significantly-affects-children-for-up-to-36-months-vaccines-offer-crucial-protection.aspx","2024-11-30"
"What if schools could prevent sick days, teacher shortages and lost IQ points? A new COVID safety course lights the way","Hayley Gleeson","ABC News","2024-09-23","COVID-19 and Education","COVID-19, schools, teacher shortages, student health, long COVID, preventive measures","This article discusses a new online course, 'COVID Safety for Schools,' created by Colin Kinner. The course aims to educate school staff and parents on reducing the spread of COVID-19 in schools, addressing issues such as teacher shortages, student health, and the risk of long COVID.","https://www.abc.net.au/news/2024-09-24/covid-safety-schools-course-sick-days-teachers-long-covid/104319032","2024-11-30"
"A CFD study on the effect of portable air cleaner placement on airborne infection control in a classroom","Gen Pei, Parham Azimi, Donghyun Rim, Joseph G. Allen","Environmental Science: Processes & Impacts","2024-07-04","Airborne Infection Control","portable air cleaners, classroom, airborne pathogens, Computational Fluid Dynamics, ventilation systems","This study utilizes Computational Fluid Dynamics (CFD) modeling to evaluate the effectiveness of portable air cleaners (PACs) in classrooms with different ventilation systems. Findings indicate that PACs with a flow rate of 2.6 h⁻¹ can reduce students' mean aerosol intake by up to 66%. Optimal PAC performance is achieved when units are placed within 3 meters of an infector or centrally in the room, with discharge heights aligned to occupants' breathing levels.","https://pubs.rsc.org/en/content/articlelanding/2024/em/d4em00114a","2024-11-30"
"The Removal of Airborne Severe Acute Respiratory Syndrome Coronavirus 2 (SARS-CoV-2) and Other Microbial Bioaerosols by Air Filtration on Coronavirus Disease 2019 (COVID-19) Surge Units","Andrew Conway Morris, Katherine Sharrocks, Rachel Bousfield, Leanne Kermack, Mailis Maes, Ellen Higginson, Sally Forrest, Joana Pereira-Dias, Claire Cormie, Tim Old, Sophie Brooks, Islam Hamed, Alicia Koenig, Andrew Turner, Paul White, R. Andres Floto, Gordon Dougan, Effrossyni Gkrania-Klotsas, Theodore Gouliouris, Stephen Baker, Vilas Navapurkar","Clinical Infectious Diseases","2022-07-01","Airborne Infection Control","SARS-CoV-2, air filtration, bioaerosols, COVID-19 wards, HEPA filters, UV sterilization","This study presents evidence of the effectiveness of portable air filtration systems with UV sterilization in removing SARS-CoV-2 RNA and other microbial bioaerosols in COVID-19 hospital units. The use of these systems significantly reduced airborne pathogens, highlighting their potential to mitigate nosocomial infections and enhance safety for healthcare workers.","https://academic.oup.com/cid/article/75/1/e97/6414657?guestAccessKey=248e14cc-d920-4782-99b7-634e47cdaa0e&login=false","2024-11-30"
"Effect of air cleaner on reducing concentration of indoor-generated viruses with or without natural ventilation","Jungsuk Lee, Su-Hoon Park, Gi-Bong Sung, Ik-Hyun An, Kyung-Rae Lee, Sung-Pyo Hong, Se-Jin Yook, Hyun Bon Koo","Aerosol Science and Technology","2021-07-13","Airborne Infection Control","air cleaners, natural ventilation, COVID-19, classrooms, virus concentration, indoor air quality","This study evaluates the effectiveness of air cleaners and natural ventilation in reducing virus concentration indoors, particularly in classrooms. It finds that using both methods together significantly reduces virus concentration compared to using either method alone, emphasizing the importance of air cleaner positioning and maintenance for optimal results.","https://www.tandfonline.com/doi/full/10.1080/02786826.2021.1945528#d1e216","2024-11-30"
"Establishment and application of test methodology demonstrating the functionality of air purification systems in reducing virus-loaded aerosol in indoor air","J.M.B.M. van der Vossen, A.P. Kreikamp, V. Hatt, A.M.T. Ouwens, D.J. Brasem, M. Heerikhuisen, R.C. Montijn","Journal of Hospital Infection","2023-03-12","Airborne Infection Control","COVID-19, virus, bacteriophage, aerosol, air purification, clean air delivery rate","This study evaluates the effectiveness of air purification systems in reducing viral load in indoor air. Using a containment room and aerosolized Feline Coronavirus (FCoV), the researchers found that HEPA and ESP-based air purification systems significantly reduced viral load in air by 97-99% within one hour. ESP technology further inactivated 99.9%-99.99% of captured infectious viruses, highlighting its potential as an adjunctive infection control measure.","https://www.journalofhospitalinfection.com/article/S0195-6701(23)00078-6/pdf","2024-11-30"
"Effectiveness of a portable personal air cleaner in reducing the airborne transmission of respiratory pathogens","Gino Cortellessa, Christian Canale, Luca Stabile, Giorgio Grossi, Giorgio Buonanno, Fausto Arpino","Building and Environment","2023-05-01","Airborne Infection Control","airborne transmission, respiratory pathogens, personal air cleaner, ventilation, CFD simulations","This study evaluates the effectiveness of a novel portable personal air cleaner in reducing the airborne transmission of respiratory pathogens in indoor environments. Using Computational Fluid Dynamics (CFD) simulations validated by experimental data, the air cleaner was found to reduce inhaled respiratory particles by over 92% in close-proximity scenarios and over 99% in shared indoor environments like lecture rooms, highlighting its efficacy in mitigating infection risk.","https://www.sciencedirect.com/science/article/abs/pii/S0360132323002494","2024-11-30"
